{
  "batchConfig" : {
    "urnBase" : "age-stratification",
    "simulationDuration" : 200,
    "exporters" : [ "SUMMARY", "INTERNAL_STATE", "HISTORICAL_TESTS", "CONTACT_NETWORK", "INFECTIVITY_PROFILE", "DEMOGRAPHICS" ]
  },
  "setupConfig" : [ {
    "@type" : "age-stratified",
    "name" : "age-stratified",
    "modifications" : [ ],
    "default" : {
      "@type" : "age-stratified",
      "name" : "age-stratified",
      "initialImports" : 5,
      "networkSize" : 10000,
      "ageDistribution" : {
        "minimum" : 0.0,
        "maximum" : 120.0,
        "x" : [ 18.0, 45.0, 65.0, 85.0 ],
        "cumulativeProbability" : [ 0.1, 0.5, 0.75, 0.9 ]
      },
      "networkConnectedness" : 100,
      "networkRandomness" : 0.1,
      "oddsContactFromAgeDifference" : {
        "x" : [ 0.0, 10.0, 25.0, 40.0, 60.0, 70.0 ],
        "y" : [ 2.0, 0.5, 1.5, 0.5, 1.0, 0.5 ],
        "link" : "LOG"
      }
    }
  } ],
  "setupReplications" : 1,
  "executionConfig" : {
    "name" : "execution",
    "asymptomaticFraction" : 0.5,
    "caseHospitalisationRate" : 0.05,
    "caseFatalityRate" : 0.01,
    "contactProbability" : {
      "type" : "UNIMODAL_BETA",
      "central" : 0.5,
      "dispersion" : 0.25
    },
    "contactDetectedProbability" : 0.9,
    "complianceProbability" : {
      "type" : "UNIMODAL_BETA",
      "central" : 0.99,
      "dispersion" : 0.1
    },
    "appUseProbability" : {
      "type" : "UNIMODAL_BETA",
      "central" : 0.97,
      "dispersion" : 0.1
    },
    "inHostConfiguration" : {
      "@type" : "phenomenological",
      "infectiousnessCutoff" : 0.2,
      "incubationPeriod" : {
        "type" : "LOG_NORM",
        "central" : 5.0,
        "dispersion" : 2.0
      },
      "approxPeakViralLoad" : {
        "type" : "UNIMODAL_BETA",
        "central" : 0.5,
        "dispersion" : 0.1
      },
      "incubationToPeakViralLoadDelay" : {
        "type" : "LOG_NORM",
        "central" : 2.0,
        "dispersion" : 1.0
      },
      "peakToRecoveryDelay" : {
        "type" : "LOG_NORM",
        "central" : 8.0,
        "dispersion" : 3.0
      },
      "approxPeakImmuneResponse" : {
        "type" : "UNIMODAL_BETA",
        "central" : 0.5,
        "dispersion" : 0.1
      },
      "peakImmuneResponseDelay" : {
        "type" : "LOG_NORM",
        "central" : 20.0,
        "dispersion" : 4.0
      },
      "immuneWaningHalfLife" : {
        "type" : "LOG_NORM",
        "central" : 300.0,
        "dispersion" : 10.0
      }
    },
    "availableTests" : [ {
      "testName" : "LFT",
      "sensitivity" : 0.9,
      "specificity" : 0.98,
      "meanTestDelay" : 0.0,
      "sdTestDelay" : 0.0
    }, {
      "testName" : "PCR",
      "sensitivity" : 0.8,
      "specificity" : 0.995,
      "meanTestDelay" : 3.0,
      "sdTestDelay" : 1.0
    } ],
    "symptomSensitivity" : {
      "type" : "UNIMODAL_BETA",
      "central" : 0.5,
      "dispersion" : 0.1
    },
    "symptomSpecificity" : {
      "type" : "UNIMODAL_BETA",
      "central" : 0.95,
      "dispersion" : 0.1
    },
    "initialEstimateInfectionDuration" : 10.0,
    "initialEstimateSymptomSensitivity" : 0.5,
    "initialEstimateSymptomSpecificity" : 0.95,
    "maximumSocialContactReduction" : {
      "type" : "UNIMODAL_BETA",
      "central" : 0.2,
      "dispersion" : 0.1
    },
    "defaultBehaviourModelName" : "Test",
    "defaultPolicyModelName" : "NoControl",
    "importationProbability" : 0.0,
    "demographicAdjustment" : {
      "contactProbability" : {
        "x" : [ 0.0, 5.0, 15.0, 25.0, 45.0, 75.0 ],
        "y" : [ 2.0, 1.0, 1.5, 1.25, 0.8, 1.2 ],
        "link" : "LOG"
      },
      "complianceProbability" : {
        "value" : 1.0
      },
      "appUseProbability" : {
        "value" : 1.0
      },
      "maximumSocialContactReduction" : {
        "value" : 1.0
      },
      "peakToRecoveryDelay" : {
        "x" : [ 0.0, 5.0, 15.0, 25.0, 45.0, 65.0 ],
        "y" : [ 1.0, 0.5, 0.5, 0.75, 1.0, 2.0 ],
        "link" : "LOG"
      },
      "incubationPeriod" : {
        "value" : 1.0
      },
      "immuneWaningHalfLife" : {
        "x" : [ 0.0, 5.0, 15.0, 25.0, 45.0, 65.0, 85.0 ],
        "y" : [ 1.0, 2.0, 2.0, 1.5, 1.0, 0.5, 0.25 ],
        "link" : "LOG"
      }
    },
    "rO" : 2.5
  },
  "facets" : [ ],
  "executionReplications" : 1
}